{
  "schema": "subactor.improvement-plan/v1",
  "id": "autonomy-example-improvement-dc8e697e50f9439a",
  "projectId": "autonomy-example",
  "mode": "propose_only",
  "generatedAt": "2026-08-06T20:17:56.143Z",
  "sourceIterationUri": "urn:subactor:iteration:sha256:86f43f4b33fa9ca82a09f85228f6152259509becbf031b26db06eabd58b45b03",
  "evidenceUris": [
    "urn:subactor:resource:sha256:e3045c6b3e43c1068ce11b67baa23470f038df66793867fc23c259a39b393305",
    "urn:subactor:resource:sha256:aa676cf171a25dade147dda1eb2d4451f9ddbd89063400896bf4a83ea3b831a7",
    "urn:subactor:resource:sha256:c2b311edb698a6bbfeaf269086135c4d7246656002fb025fa2d47f3de1c1020a",
    "urn:subactor:resource:sha256:a14b982163ca113436e2d197e577f33be85c32a7e4cfcaf952af2f4b77266887",
    "urn:subactor:resource:sha256:897ce7b61f60c6352e129f50894c4c3b3f2404c928fc1b7fdf1e6c7fd357b759",
    "urn:subactor:resource:sha256:537043bcc90c9aa7969876ee906604872475647b3f8fc55064794f3fd98f1924",
    "urn:subactor:resource:sha256:0ba64e33e87ecbaa126af75b68fa11da8c29d9ee8c35890936d7c9cf886af7e3",
    "urn:subactor:resource:sha256:268d19d121f9bb44f287b863ec043f4d65b2d64e2bfed605925b804aa887a294",
    "urn:subactor:resource:sha256:dc4c645de2ace1eed37c22d76481467669f195f9f705b133e6ef2a1df846028b",
    "urn:subactor:resource:sha256:d47115bd8f7b695a7d70024e7423a898c10ba77d7e7b4018e719cd929ba33a5e",
    "urn:subactor:resource:sha256:f625349ef6b290ba2df48ad84f5db3ed9b49d048cbd1bb580d297a31a33d9c1c",
    "urn:subactor:intent:sha256:aa344be4e9f724b377ca1bbf11d31d9900a27b4bcdc559c68f994338e62dd004"
  ],
  "actions": [
    {
      "id": "action-1",
      "kind": "validation",
      "title": "Resolve development diagnostics",
      "reason": "Development evidence is not accepted by the deterministic acceptance gate.",
      "targetUris": [
        "urn:subactor:intent:sha256:aa344be4e9f724b377ca1bbf11d31d9900a27b4bcdc559c68f994338e62dd004"
      ],
      "approvalRequired": true,
      "status": "proposed"
    },
    {
      "id": "action-2",
      "kind": "validation",
      "title": "Review rejected LLM authority override",
      "reason": "LLM_AUTHORITY_EXPRESSION_IGNORED:DevelopmentGate",
      "targetUris": [
        "subactor://project/autonomy-example/math/authority"
      ],
      "approvalRequired": true,
      "status": "proposed"
    },
    {
      "id": "action-3",
      "kind": "validation",
      "title": "Resolve blocked iteration",
      "reason": "IterationAllowed=false",
      "targetUris": [
        "subactor://project/autonomy-example/iteration"
      ],
      "approvalRequired": true,
      "status": "proposed"
    },
    {
      "id": "action-4",
      "kind": "validation",
      "title": "Resolve blocked iteration",
      "reason": "ScenePublishAllowed=false",
      "targetUris": [
        "subactor://project/autonomy-example/iteration"
      ],
      "approvalRequired": true,
      "status": "proposed"
    }
  ]
}
